{
  "generated_at": "2026-09-26T18:40:00.000Z",
  "rules_confirmed": false,
  "dev": {
    "n": 800,
    "min_dcf_a": 0.21,
    "min_dcf_b": 0.18,
    "eer": 0.07
  },
  "detectors": [
    {
      "name": "df_arena_500m",
      "min_dcf_a": 0.24,
      "min_dcf_b": 0.2
    }
  ],
  "fusion": {
    "method": "mean_rank",
    "members": [
      "df_arena_500m"
    ]
  },
  "ablation": []
}
